{
  "$schema": "https://json-schema.org/draft/2020-12/schema",
  "type": "object",
  "required": [
    "schema_version",
    "candidate",
    "inputs",
    "authority_effect",
    "kind",
    "chapter",
    "route",
    "run",
    "authors",
    "template",
    "task",
    "prompt_sha256",
    "parent",
    "feedback"
  ],
  "properties": {
    "schema_version": {
      "enum": [1, 2]
    },
    "candidate": {
      "type": "object",
      "required": [
        "path",
        "sha256"
      ],
      "properties": {
        "path": {
          "type": "string",
          "minLength": 1
        },
        "sha256": {
          "type": "string",
          "pattern": "^[a-f0-9]{64}$"
        }
      },
      "additionalProperties": false
    },
    "inputs": {
      "type": "array",
      "items": {
        "type": "object",
        "required": [
          "path",
          "sha256"
        ],
        "properties": {
          "path": {
            "type": "string",
            "minLength": 1
          },
          "sha256": {
            "type": "string",
            "pattern": "^[a-f0-9]{64}$"
          }
        },
        "additionalProperties": false
      }
    },
    "authority_effect": {
      "const": "NONE"
    },
    "kind": {
      "const": "WRITING_DRAFT"
    },
    "chapter": {
      "type": "integer",
      "minimum": 1
    },
    "route": {
      "enum": [
        "direct",
        "harness"
      ]
    },
    "run": {
      "type": "object",
      "required": [
        "path",
        "sha256"
      ],
      "properties": {
        "path": {
          "type": "string",
          "minLength": 1
        },
        "sha256": {
          "type": "string",
          "pattern": "^[a-f0-9]{64}$"
        }
      },
      "additionalProperties": false
    },
    "input_snapshot": {"type":"object","required":["path","sha256"],"properties":{"path":{"type":"string","minLength":1},"sha256":{"type":"string","pattern":"^[a-f0-9]{64}$"}},"additionalProperties":false},
    "selection_context": {"type":"object"},
    "dependency_records": {"type":"array","items":{"type":"object","required":["kind","id","sha256","value"],"properties":{"kind":{"enum":["SOURCE","CLAIM","ASSET"]},"id":{"type":"string","minLength":1},"sha256":{"type":"string","pattern":"^[a-f0-9]{64}$"},"value":{"type":"object"}},"additionalProperties":false}},
    "execution_basis": {"enum": ["PROVIDER_RUN", "SESSION_AUTHORED_NOT_PROVIDER_VERIFIED"]},
    "prepared_request": {"$ref": "#/$defs/binding"},
    "package": {"$ref": "#/$defs/binding"},
    "qualification": {"const": "RESEARCH_ONLY"},
    "formal_eligibility": {"const": false},
    "human_qualification": {"const": false},
    "raw_run": {
      "type": "object",
      "required": [
        "path",
        "sha256"
      ],
      "properties": {
        "path": {
          "type": "string",
          "minLength": 1
        },
        "sha256": {
          "type": "string",
          "pattern": "^[a-f0-9]{64}$"
        }
      },
      "additionalProperties": false
    },
    "authors": {
      "type": "array",
      "minItems": 1,
      "items": {
        "type": "object",
        "required": ["principal_id", "source_id", "kind", "run"],
        "properties": {
          "principal_id": {"type": "string", "minLength": 1},
          "source_id": {"type": "string", "minLength": 1},
          "kind": {"const": "MODEL"},
          "run": {"type": "object", "required": ["path", "sha256"], "properties": {"path": {"type": "string"}, "sha256": {"type": "string", "pattern": "^[a-f0-9]{64}$"}}, "additionalProperties": false}
        },
        "additionalProperties": false
      }
    },
    "template": {
      "type": "object",
      "required": [
        "path",
        "sha256"
      ],
      "properties": {
        "path": {
          "type": "string",
          "minLength": 1
        },
        "sha256": {
          "type": "string",
          "pattern": "^[a-f0-9]{64}$"
        }
      },
      "additionalProperties": false
    },
    "task": {
      "type": "object"
    },
    "prompt_sha256": {
      "type": "string",
      "pattern": "^[a-f0-9]{64}$"
    },
    "parent": {
      "anyOf": [
        {
          "type": "object",
          "required": [
            "path",
            "sha256"
          ],
          "properties": {
            "path": {
              "type": "string",
              "minLength": 1
            },
            "sha256": {
              "type": "string",
              "pattern": "^[a-f0-9]{64}$"
            }
          },
          "additionalProperties": false
        },
        {
          "type": "null"
        }
      ]
    },
    "feedback": {
      "anyOf": [
        {
          "type": "object",
          "required": [
            "path",
            "sha256"
          ],
          "properties": {
            "path": {
              "type": "string",
              "minLength": 1
            },
            "sha256": {
              "type": "string",
              "pattern": "^[a-f0-9]{64}$"
            }
          },
          "additionalProperties": false
        },
        {
          "type": "null"
        }
      ]
    }
  },
  "allOf": [{
    "if": {"required": ["execution_basis"], "properties": {"execution_basis": {"const": "SESSION_AUTHORED_NOT_PROVIDER_VERIFIED"}}},
    "then": {
      "required": ["prepared_request", "package", "qualification", "formal_eligibility", "human_qualification"],
      "not": {"required": ["raw_run"]}
    },
    "else": {
      "required": ["raw_run"],
      "not": {"anyOf": [{"required": ["prepared_request"]}, {"required": ["package"]}]}
    }
  }, {"if":{"properties":{"schema_version":{"const":2}}},"then":{"required":["input_snapshot"]},"else":{"not":{"required":["input_snapshot"]}}}],
  "$defs": {
    "binding": {
      "type": "object", "required": ["path", "sha256"],
      "properties": {"path": {"type": "string", "minLength": 1}, "sha256": {"type": "string", "pattern": "^[a-f0-9]{64}$"}},
      "additionalProperties": false
    }
  },
  "additionalProperties": false
}
