{"authority_effect":"NONE","authors":[{"kind":"MODEL","principal_id":"session:session:pilot-direct-two-revision1:phase5","run":{"path":"artifacts/author-runs/b661100f626181129ab7c0f8685c68fcc57728274526fd8961c0aff7cf469611.json","sha256":"b661100f626181129ab7c0f8685c68fcc57728274526fd8961c0aff7cf469611"},"source_id":"session-author:b661100f626181129ab7c0f8685c68fcc57728274526fd8961c0aff7cf469611"}],"candidate":{"path":"artifacts/candidates/ch85/2b57d9c39e36f99db83812085bd2a627c86fc6335346ac93242bf50c3d9e12f2.txt","sha256":"2b57d9c39e36f99db83812085bd2a627c86fc6335346ac93242bf50c3d9e12f2"},"chapter":85,"execution_basis":"SESSION_AUTHORED_NOT_PROVIDER_VERIFIED","feedback":{"path":"data/writing/feedback/a2ce9d30f96afb3c7499b851a83042d08a67065baf1afd1c23df89356f7e128c.json","sha256":"a2ce9d30f96afb3c7499b851a83042d08a67065baf1afd1c23df89356f7e128c"},"formal_eligibility":false,"human_qualification":false,"inputs":[{"path":"artifacts/agent_research/phase5/inputs/writing/baseline-ch84.md","sha256":"b8e05a5a772afbdae54d01ef27da18646f8f561ccfb93ff5fc624677090aa936"},{"path":"corpus/front80/v1-candidate/manifest.json","sha256":"033395831d12b5809eb0c87a71fd2728367d1e191ccf1db94eda7259ef5057e3"},{"path":"data/knowledge/v03_slice1.json","sha256":"53f68a3b7728fdb38af4c854e39a8c76a3aeb370086c8fb55a146484b6b049ed"},{"path":"data/knowledge/v03_slice2.json","sha256":"37db9f32aad64636f33eb70a73130160260914e8a4ca987e03f6c45170fa88e7"},{"path":"data/objects/m4.json","sha256":"5c2719605b0d2b78d3c06d6bb7444c5c5058fd3891879f8dcfa480cd1828b4db"},{"path":"data/objects/medicine_bowl.yaml","sha256":"ad304b16d955e904b6de156bf88c38f51f0d552698bb7f2ff6ba07bb5572d361"},{"path":"data/planning/chapters/ch85.json","sha256":"e98bba7be7c3fde71b9008cdcce31fae9be2d5cf36ec773f391403c5c8d18535"},{"path":"data/planning/hints.json","sha256":"a8b92c640a0831efc007c9a559cc42b403907ccf9d12edcd0b7046762032937b"},{"path":"data/planning/scenes/85-S1.json","sha256":"fa2f7aad41e7bcc5e80441619e5427d1696569a0dc7ad1791b026efd4a130b87"},{"path":"data/planning/scenes/85-S2.json","sha256":"a6e18111bf9d2b472c65855fd0307ad45e2f020637155aa6736a1fe3f11e1c33"},{"path":"data/planning/scenes/85-S3.json","sha256":"0db7de864eef73bf40128f8ef0a747c9bf668501555096e2d849a9c901cf566d"},{"path":"data/project/capability.json","sha256":"a171e007d93228e53c3127ebde1a8cf34bd38dfc9ab118fdf94c05cadee6b93f"},{"path":"data/project/closure_roots.json","sha256":"92aa01a9de327b88ab9d197508fbd1cd437915d5c4080298ee66d823bb627da3"},{"path":"data/project/current.json","sha256":"fc269b4ba5b557eda0413e604dc08319efdf84519a26f15471bc8599d40722b9"},{"path":"data/project/delivery.json","sha256":"59308a8406080f1b38245df7c701f37fe13ce451dbbfe330a0d45614b47a287c"},{"path":"data/project/implementation.json","sha256":"c50ee322ccf86cfd1a794db317491623601564dc755bb5066da967810e232667"},{"path":"data/project/layout_changes.json","sha256":"b24cde053b2200440c22559955d042a3e3e87cb57123fd27404cdf3b9534a0ab"},{"path":"data/project/plan_constraints_v1.json","sha256":"8f3ca1572c57e6440d94eb151680f189994b6c2097a5c02609b55e35a32b94cd"},{"path":"data/project/rights_inventory.json","sha256":"35b10f2638e3a4125e4ac2df65b3e535a0e1202c9381ea007ea3bedca64db7a0"},{"path":"data/project/scope.json","sha256":"ecd0c76ea442f5538a3bd5d12f1f3e33d0243318032b5c0446789fb5fdb91dbe"},{"path":"data/project/source_gap_baseline.json","sha256":"c63a9e198bedfdd3e84b3e0989deba9807fdbe2928f27306c782128d45c4c934"},{"path":"data/provenance/sources/canary.yaml","sha256":"b7758143561ec761d37e2ad3ad46df7fe13e9309bb27441ddad2ca21916478d6"},{"path":"data/provenance/sources/r4_core_completion.yaml","sha256":"1c7f64032532a2f16987a7a11c1e417c8c6b47f9c1b933a31e555b18fee02af4"},{"path":"data/provenance/sources/r4_historical.yaml","sha256":"cbea8882712a91f4f8eb6764de4500625920a509101151ae4427842cc44d9820"},{"path":"data/provenance/sources/r4_literal_core.yaml","sha256":"2feefc72a88ed220b3f2f841e76e66af9048261fb70926610a2e9e2043630a57"},{"path":"data/provenance/sources/r4_title_axis.yaml","sha256":"49cb643821b8c4ea75cc6979ba4fcd5209d62f7808d816179e81b1f92772dfd2"},{"path":"data/provenance/sources/r4_w2.yaml","sha256":"e54b1ae71e7c229e3f9c9bbc08180300ef60d00d83e20c9c197a199a5dbd0a95"},{"path":"data/world/m3_body.json","sha256":"429ca248ea42aa0601e11a55d40fa446da92cee48936627a83b335ab9b18056e"},{"path":"data/world/m3_core.json","sha256":"c4bf1c75fda8994fd846e570a64ae69efeb6ca17cd27e78c1bb1af4d7783d733"},{"path":"data/world/m3_knowledge.json","sha256":"d8ee374ec667317af6ef304dc4b66ad7d3ceae9f20753c1b35cf029c73dee18b"},{"path":"data/world/m3_locations.json","sha256":"ed1a4053f1459193777f486b3a9743c5aec28afb7d027dee12684da6e3a9d81b"},{"path":"data/world/m3_presence.json","sha256":"7880480b001c321e50056e887f1285f6c7ccf975aed140d1515967ea925bb3bb"},{"path":"data/world/m3_resources.json","sha256":"b823f72594d4a2af2216525cbfd3411b00d41c4ad0fa89830348933be6de7668"},{"path":"data/writing/exemplars/ch89-research-v1.json","sha256":"5b93c888218bfa5d3287bf24ab2f5de6d01255fc8d8004d61577b154cb27333b"},{"path":"data/writing/packages/ch85-research-v1.json","sha256":"225eab6d8112bb25ea7fe0581448e0d684985d8e3938451a0449b98b6d6f9107"},{"path":"data/writing/prompts/author-v1.md","sha256":"400191a56b1d057ead22019174ba890692f2ddc83abe4ad23121de7471630300"},{"path":"artifacts/candidates/ch85/3eb549344ff67cbb7af12ea93a02cba0e28a353d2b867f563f423ef273ed2b25.txt","sha256":"3eb549344ff67cbb7af12ea93a02cba0e28a353d2b867f563f423ef273ed2b25"},{"path":"data/writing/drafts/ch85/bf0e56792f72ed2af7965c3533bb6bfac74e06ee3e221e2844c0f9822a2d4e3f.json","sha256":"bf0e56792f72ed2af7965c3533bb6bfac74e06ee3e221e2844c0f9822a2d4e3f"},{"path":"data/writing/feedback/a2ce9d30f96afb3c7499b851a83042d08a67065baf1afd1c23df89356f7e128c.json","sha256":"a2ce9d30f96afb3c7499b851a83042d08a67065baf1afd1c23df89356f7e128c"},{"path":"artifacts/agent_research/phase5/inputs/writing/pilot-direct-two-ch85-editor-notes.json","sha256":"ab0a48b95dfa111b093e95c61aaa2a28f01664afab1cde267edc0f05d8a32cfc"}],"kind":"WRITING_DRAFT","package":{"path":"data/writing/packages/ch85-research-v1.json","sha256":"225eab6d8112bb25ea7fe0581448e0d684985d8e3938451a0449b98b6d6f9107"},"parent":{"path":"data/writing/drafts/ch85/bf0e56792f72ed2af7965c3533bb6bfac74e06ee3e221e2844c0f9822a2d4e3f.json","sha256":"bf0e56792f72ed2af7965c3533bb6bfac74e06ee3e221e2844c0f9822a2d4e3f"},"prepared_request":{"path":"artifacts/writing-requests/acb4b267683cdc2d9daddaeebba9554ff9afb96f4ccf992ab74541945d16e521.json","sha256":"acb4b267683cdc2d9daddaeebba9554ff9afb96f4ccf992ab74541945d16e521"},"prompt_sha256":"43359ffaf571f0432a4d18ff018fb57a233c31d1b9b948e6c1f7df2e0afc3175","qualification":"RESEARCH_ONLY","route":"direct","run":{"path":"artifacts/author-runs/b661100f626181129ab7c0f8685c68fcc57728274526fd8961c0aff7cf469611.json","sha256":"b661100f626181129ab7c0f8685c68fcc57728274526fd8961c0aff7cf469611"},"schema_version":1,"task":{"editorial_notes":"{\"advice_source\":{\"path\":\"artifacts/agent_research/phase5/submissions/pilot-direct-two-literary-feedback.json\",\"sha256\":\"5fab168751fa1b5348ac825b37fab59248a332657c824ecb961123785006b2a5\"},\"authority_effect\":\"NONE\",\"draft\":{\"path\":\"data/writing/drafts/ch85/bf0e56792f72ed2af7965c3533bb6bfac74e06ee3e221e2844c0f9822a2d4e3f.json\",\"sha256\":\"bf0e56792f72ed2af7965c3533bb6bfac74e06ee3e221e2844c0f9822a2d4e3f\"},\"notes\":[{\"issue\":\"两回月头的时间推进之后，湿发、湿鞋、枕巾、净帕袋和晾架又连成一组同等分量的小麻烦；它们大多重复“别图省事、另放清楚”，没有相应推进病程，后半回节奏停在照料演示上。\",\"proposed_edit\":\"在湿发、借软鞋和晾枕巾几段中选一段展开，其余并入夜守的短过渡。保留一个黛玉仍能逗丫头的瞬间，再让起坐或夜醒的变化接上，避免连续五次解决相似布物问题。\",\"quotes\":[\"你把它挂到竹梢上，倒谁也碰不着\",\"一条巾子，早起是我催它干，晚上倒像它催你们搬\"],\"retain\":\"保留普通病日而非开篇临终、半碗到碗底的长期食量下降、偶有好转与真实饭药热水供应；这些已成立，不需要另造急病或穷困原因。保留“这一下不许记在我账上”的活声即可，不必尽删笑料。\"},{\"issue\":\"黛玉、紫鹃、雪雁几乎每轮对话都轮流给器物安上脾性，再接一句反转；机锋密度虽高，却让三人越来越像同一个随时备好俏皮答复的人。\",\"proposed_edit\":\"保留黛玉最锋利的一两句倒转话，紫鹃有些地方只接半句便做事，雪雁则留直接辩解、说错后脸红或没接住话的空隙。不要每次器物拟人都让下一人再加一层机锋。\",\"quotes\":[\"我不过说暗，你便替它找出这许多亲戚\",\"它有嘴，若肯自己走过来，我们也不用搬\",\"你别做天的媒人\"],\"retain\":\"保留药铺账、“听咳有功、记账第一”与黛玉嫌烦的核心笑声，也保留雪雁照料中的笨拙。区别声口不是把病人写得寡言端庄或让丫头只剩劳务功能。\"},{\"issue\":\"宝钗的换守与厨房照料都有具体行动，但对白又逐条定义何为正确照料，和大夫、紫鹃的观察原则重叠，人物显得只在输出标准答案。\",\"proposed_edit\":\"让莺儿真的来换守、紫鹃终于脱鞋睡下承担第一句的意思，可删去角色解释。厨房关于稀粥“不养人”的争执保留，但宝钗只需说明先照紫鹃回的话做、再请大夫问，不必又把全回的观察原则总结一遍。\",\"quotes\":[\"不是多个人来问安，是替你守半个时辰\",\"大夫要问的是吃下多少，不是碗里看着多少\"],\"retain\":\"保留莺儿轮守所带来的实际劳力、宝钗不强占床前位置、厨房并非吝惜那一口米。不要为增加缺点而硬造争权，也不提前宣布宝钗日后的婚姻角色。\"},{\"issue\":\"理书理稿段几次先说明“不作什么”“不能当遗物”，把日常收整写成了对未来死亡与实施禁区的防御；尤其“遗物”一词过早从旁白压到仍在安排明日的黛玉身上。\",\"proposed_edit\":\"删去这两处替行为预先定性的说明，保留旧折纸套、黛玉指原处和普通小稿暂留笔砚的动作。用她嫌别人收得过快的口气体现稿件仍供日后使用，不必预告它们会成遗物。\",\"quotes\":[\"原不是要作什么\",\"知道不能一概当遗物似的供着\"],\"retain\":\"A01只显“十独吟”题名、纸套不展开且不数篇，作者与形制仍开放；不补十首或归为黛玉亲作。普通G01尝试改字而未落字，与题名纸套分放；86回才最终停笔，不改成临终写成的作品。\"}],\"qualification\":\"FEEDBACK_ONLY\"}\n","feedback":{"authority_effect":"NONE","candidate":{"path":"artifacts/candidates/ch85/3eb549344ff67cbb7af12ea93a02cba0e28a353d2b867f563f423ef273ed2b25.txt","sha256":"3eb549344ff67cbb7af12ea93a02cba0e28a353d2b867f563f423ef273ed2b25"},"checks":[{"evaluator":"scene_state","findings":["DRAFT_SCENE_NO_EXECUTABLE_STATE_CONTRACT"],"qualification":"FEEDBACK_ONLY","scene":"85-S1","status":"PENDING"},{"evaluator":"scene_state","findings":["DRAFT_SCENE_NO_EXECUTABLE_STATE_CONTRACT"],"qualification":"FEEDBACK_ONLY","scene":"85-S2","status":"PENDING"},{"evaluator":"scene_state","findings":["DRAFT_SCENE_NO_EXECUTABLE_STATE_CONTRACT"],"qualification":"FEEDBACK_ONLY","scene":"85-S3","status":"PENDING"},{"details":{"authority_effect":"NONE","candidate_sha256":"3eb549344ff67cbb7af12ea93a02cba0e28a353d2b867f563f423ef273ed2b25","character_count":8689,"literary_quality_verified":false,"poetry_track":[],"prose_track":{"address_forms":{"二爷":5,"只说姑娘":1,"听见姑娘":1,"姑娘":12,"宝姑娘":1,"我替姑娘":1,"敢惜姑娘":1,"昨儿姑娘":1,"欺负姑娘":1,"等姑娘":1,"请二爷":1,"谁替姑娘":1},"address_relationship_consistency":"PENDING_ATTRIBUTED_READING","narrator_markers":{"不在话下":0,"且说":0,"却说":1,"原来":2,"欲知后事":0,"话说":2},"paragraph_lengths":[23,200,175,180,198,192,197,201,163,189,187,212,187,180,202,204,212,218,159,1